<?xml version="1.0" encoding="UTF-8" standalone="no"?>
<Classe xmlns:xsi="http://www.w3.org/2001/XMLSchema-instance" xsi:noNamespaceSchemaLocation="./imbrication.xsd">
    <Enleves>
        <Enleve>
            <nom>bla</nom>
            <prenom>bla</prenom>
            <dateNaissance>1976-12-30</dateNaissance>
            <Email>coGG@co.be</Email>
        </Enleve>
        <Enleve>
            <nom>bla</nom>
            <prenom>bla</prenom>
            <dateNaissance>1976-12-30</dateNaissance>
            <Email>coGG@co.be</Email>
        </Enleve>
        <Enleve>
            <nom>bla</nom>
            <prenom>bla</prenom>
            <dateNaissance>1976-12-30</dateNaissance>
            <Email>coGG@co.be</Email>
        </Enleve>
        <Enleve>
            <nom>bla</nom>
            <prenom>bla</prenom>
            <dateNaissance>1976-12-30</dateNaissance>
            <Email>coGG@co.be</Email>
        </Enleve>
        <Enleve>
            <nom>bla</nom>
            <prenom>bla</prenom>
            <dateNaissance>1976-12-30</dateNaissance>
            <Email>coGG@co.be</Email>
        </Enleve>
        <Enleve>
            <nom>bla</nom>
            <prenom>bla</prenom>
            <dateNaissance>1976-12-30</dateNaissance>
            <Email>coGG@co.be</Email>
        </Enleve>
    </Enleves>

    <Professeur>
        <nom>Jo</nom>
        <prenom>Jo</prenom>
        <titre>ooooo</titre>
        <anne>1992</anne>
        <adresse>
            <rue>blabla</rue>
            <numero>4</numero>
            <boite>5</boite>
            <code_postal>1000</code_postal>
            <ville>Bruxelles</ville>
        </adresse>
        <n_telephone>213654412</n_telephone>
        <Email>coGG@co.be</Email>
        <CoursDonne>
            <titre>lala</titre>
            <nCredits>5</nCredits>
        </CoursDonne>
        <CoursDonne>
            <titre>lala</titre>
            <nCredits>5</nCredits>
        </CoursDonne>
    </Professeur>
</Classe>